{"$schema":"https://json-schema.org/draft/2020-12/schema","$id":"https://raw.githubusercontent.com/dkharlanau/agent-ready-web-profile/main/schema/localization-profile.schema.json","title":"Goose ARWP Localization Profile v0.2","description":"Executable locale/market/surface contract. Locale and market are separate, parity is explicit, and Search requirements are distinguished from optional agent/product contracts.","type":"object","additionalProperties":false,"required":["version","sourceLocale","defaultLocale","locales","markets","surfaces","impactRules"],"properties":{"$schema":{"type":"string","format":"uri"},"version":{"const":"0.2"},"site":{"type":["string","null"],"format":"uri"},"sourceLocale":{"type":"string","minLength":2,"maxLength":35},"defaultLocale":{"type":"string","minLength":2,"maxLength":35},"fallbackPolicy":{"type":"string"},"glossaryFile":{"type":"string"},"debtLedger":{"type":"string"},"sitemapManifest":{"type":"string"},"localeManifest":{"type":"string"},"searchGuidanceRegistry":{"type":"string"},"xDefaultPolicy":{"enum":["source-locale","default-locale","none"]},"hreflangStrategy":{"$ref":"#/$defs/hreflangStrategy"},"evidenceBoundary":{"type":"string"},"locales":{"type":"array","minItems":1,"items":{"$ref":"#/$defs/locale"}},"markets":{"type":"array","items":{"$ref":"#/$defs/market"}},"surfaces":{"type":"array","items":{"$ref":"#/$defs/surface"}},"impactRules":{"type":"array","items":{"$ref":"#/$defs/impactRule"}}},"$defs":{"locale":{"type":"object","additionalProperties":false,"required":["code","role"],"properties":{"code":{"type":"string","minLength":2,"maxLength":35},"label":{"type":"string"},"role":{"enum":["canonical","human-interface","routing-only","agent-routing"]},"status":{"type":"string"},"markets":{"type":"array","uniqueItems":true,"items":{"type":"string","pattern":"^[A-Z]{2}$"}},"searchPublication":{"enum":["full","none","limited"]}}},"market":{"type":"object","additionalProperties":false,"required":["code"],"properties":{"code":{"type":"string","pattern":"^[A-Z]{2}$"},"locales":{"type":"array","uniqueItems":true,"items":{"type":"string"}},"notes":{"type":"string"}}},"hreflangStrategy":{"type":"object","additionalProperties":false,"required":["representations"],"properties":{"equivalenceGraph":{"type":"string"},"representations":{"type":"array","minItems":1,"uniqueItems":true,"items":{"enum":["html","http-header","sitemap"]}},"googleSpecificValidation":{"type":"boolean"},"notes":{"type":"string"}}},"surface":{"type":"object","additionalProperties":false,"required":["id","kind","parity","requiredForRoles"],"properties":{"id":{"type":"string"},"kind":{"enum":["json-key-set","json-record-set","rendered-page-manifest","machine-files","manual"]},"parity":{"enum":["exact","semantic","adapted","market-specific","routing-only"]},"surfaceClass":{"enum":["search-required","accessibility-semantic-web","optional-agent-interoperability","product-specific-machine-contract","experimental-emerging"]},"authority":{"enum":["standards-requirement","google-specific-requirement","arwp-stronger-recommendation","product-specific-contract","experimental-emerging"]},"searchRequirement":{"enum":["required","optional","not-applicable"]},"canonicalSource":{"type":"string"},"localePattern":{"type":"string"},"recordsPath":{"type":"string"},"stableIdField":{"type":"string"},"localizedSlugField":{"type":"string"},"sourceHashField":{"type":"string"},"membership":{"enum":["exact","subset","independent"]},"requiredFields":{"type":"array","uniqueItems":true,"items":{"type":"string"}},"valueFields":{"type":"array","uniqueItems":true,"items":{"type":"string"}},"marketFields":{"type":"array","uniqueItems":true,"items":{"type":"string"}},"requiredForRoles":{"type":"array","uniqueItems":true,"items":{"enum":["human-interface","routing-only"]}},"disallowSourceEqual":{"type":"boolean"},"allowSourceEqualKeys":{"type":"array","items":{"type":"string"}},"requireNfc":{"type":"boolean"},"requireHreflang":{"type":"boolean"},"requireSitemap":{"type":"boolean"},"requireSearchMetadata":{"type":"boolean"},"requireStructuredDataLanguage":{"type":"boolean"},"requiredTokens":{"type":"array","items":{"type":"string"}},"prohibitedMarkers":{"type":"array","items":{"type":"string"}},"checks":{"type":"array","items":{"type":"string"}}}},"impactRule":{"type":"object","additionalProperties":false,"required":["paths","surfaces"],"properties":{"paths":{"type":"array","minItems":1,"items":{"type":"string"}},"surfaces":{"type":"array","minItems":1,"items":{"type":"string"}}}}}}