{"$schema":"https://raw.githubusercontent.com/dkharlanau/agent-ready-web-profile/main/schema/localization-profile.schema.json","version":"0.2","site":"https://example.test/","sourceLocale":"en","defaultLocale":"en","fallbackPolicy":"explicit-by-surface","locales":[{"code":"en","label":"English","role":"canonical","status":"published","markets":["US"],"searchPublication":"full"},{"code":"fr","label":"Français","role":"human-interface","status":"published","markets":["FR"],"searchPublication":"full"},{"code":"pt-BR","label":"Português (Brasil)","role":"human-interface","status":"published","markets":["BR"],"searchPublication":"full"},{"code":"de","label":"Deutsch","role":"routing-only","status":"published-limited","markets":["DE"],"searchPublication":"none"}],"markets":[{"code":"US","locales":["en"]},{"code":"FR","locales":["fr"]},{"code":"BR","locales":["pt-BR"]},{"code":"DE","locales":["de"]}],"glossaryFile":"glossary.json","debtLedger":"debt.json","sitemapManifest":"meta/sitemap-locales.json","surfaces":[{"id":"ui","kind":"json-key-set","parity":"exact","canonicalSource":"en/ui.json","localePattern":"{locale}/ui.json","requiredForRoles":["human-interface"],"disallowSourceEqual":true,"requireNfc":true,"checks":["exact-key-parity","placeholder-parity","no-silent-fallback"]},{"id":"decision-skills","kind":"json-record-set","parity":"semantic","canonicalSource":"en/content.json","localePattern":"{locale}/content.json","stableIdField":"canonicalId","localizedSlugField":"slug","sourceHashField":"sourceHash","requiredFields":["canonicalId","slug","title","summary","evidenceStatus","sourceHash"],"valueFields":["title","summary"],"requiredForRoles":["human-interface"],"checks":["exact-id-parity","source-current","required-fields","unique-localized-slug","glossary"]},{"id":"pages","kind":"rendered-page-manifest","parity":"adapted","canonicalSource":"en/pages.json","localePattern":"{locale}/pages.json","stableIdField":"canonicalId","localizedSlugField":"slug","requiredForRoles":["human-interface"],"requireHreflang":true,"requireSitemap":true,"requireSearchMetadata":true,"requireStructuredDataLanguage":true,"checks":["html-lang","self-canonical","reciprocal-hreflang","sitemap-membership","localized-metadata","structured-data-language","canonical-entity-identity"]},{"id":"market-offers","kind":"json-record-set","parity":"market-specific","canonicalSource":"en/offers.json","localePattern":"{locale}/offers.json","stableIdField":"canonicalId","membership":"independent","marketFields":["market","price","availability"],"requiredFields":["canonicalId","market","price","availability"],"requiredForRoles":["human-interface"],"checks":["required-fields","market-truth-is-not-translation-parity"]},{"id":"agent-routing","kind":"machine-files","parity":"routing-only","localePattern":"{locale}/llms.txt","requiredForRoles":["routing-only"],"requiredTokens":["Locale: de"],"checks":["declared-routing-surface","search-isolation"]}],"impactRules":[{"paths":["en/ui.json","components/**"],"surfaces":["ui"]},{"paths":["en/content.json"],"surfaces":["decision-skills","pages"]},{"paths":["en/pages.json","templates/**"],"surfaces":["pages"]},{"paths":["en/offers.json","market-data/**"],"surfaces":["market-offers"]},{"paths":["ai/**","routing/**"],"surfaces":["agent-routing"]}],"evidenceBoundary":"A passing result proves only declared source/build observations. It does not prove indexing, ranking, AI citation, recommendation, traffic or conversion."}