{"$schema":"https://raw.githubusercontent.com/dkharlanau/agent-ready-web-profile/main/schema/localization-profile.schema.json","version":"0.2","site":"https://example.test/","sourceLocale":"en","defaultLocale":"en","fallbackPolicy":"explicit-by-surface","locales":[{"code":"en","label":"English","role":"canonical","status":"published","markets":["US"],"searchPublication":"full"},{"code":"fr","label":"Français","role":"human-interface","status":"published","markets":["FR"],"searchPublication":"full"},{"code":"de","label":"Deutsch","role":"routing-only","status":"published-limited","markets":["DE"],"searchPublication":"none"}],"markets":[{"code":"US","locales":["en"]},{"code":"FR","locales":["fr"]},{"code":"DE","locales":["de"]}],"surfaces":[{"id":"ui","kind":"json-key-set","parity":"exact","canonicalSource":"src/i18n/en.json","localePattern":"src/i18n/{locale}.json","requiredForRoles":["human-interface"]},{"id":"knowledge","kind":"json-record-set","parity":"semantic","canonicalSource":"data/en.json","localePattern":"data/{locale}.json","stableIdField":"canonicalId","requiredForRoles":["human-interface"]},{"id":"pages","kind":"rendered-page-manifest","parity":"adapted","canonicalSource":"build/en-pages.json","localePattern":"build/{locale}-pages.json","stableIdField":"canonicalId","requiredForRoles":["human-interface"]},{"id":"offers","kind":"json-record-set","parity":"market-specific","canonicalSource":"data/offers-us.json","localePattern":"data/offers-{locale}.json","stableIdField":"canonicalId","marketFields":["price","availability"],"requiredForRoles":["human-interface"]},{"id":"agent-routing","kind":"machine-files","parity":"routing-only","localePattern":"ai/{locale}/llms.txt","requiredForRoles":["routing-only"]}],"impactRules":[{"paths":["src/i18n/en.json","data/en.json","components/**"],"surfaces":["ui","knowledge","pages"]},{"paths":["data/offers-*.json"],"surfaces":["offers"]},{"paths":["ai/**"],"surfaces":["agent-routing"]}],"evidenceBoundary":"Implementation verification only; no Search or AI outcome guarantee."}